{
  "$schema_version": "1.0.0",
  "profile_id": "affiliate_fast",
  "extends": "base",
  "display_name": "Affiliate Fast — @iz_lue",
  "description": "TikTok fast-paced affiliate/product review for @iz_lue. Result-first hook with direct CTA.",
  "account": "@iz_lue",
  "reference_duration_seconds": 40,
  "min_duration_seconds": 25,
  "max_duration_seconds": 50,
  "narrative": {
    "stages": [
      {
        "name": "result_or_pain_hook",
        "label": "Result / Pain Hook",
        "start_seconds": 0,
        "end_seconds": 2,
        "required": true,
        "description": "Immediate result reveal or relatable pain point — stop the scroll"
      },
      {
        "name": "product_context",
        "label": "Product Context",
        "start_seconds": 2,
        "end_seconds": 7,
        "required": true,
        "description": "Introduce the product with clear branding and what it does"
      },
      {
        "name": "demonstration",
        "label": "Demonstration",
        "start_seconds": 7,
        "end_seconds": 22,
        "required": true,
        "description": "Hands-on demo with close-ups showing product in action"
      },
      {
        "name": "experience_or_evidence",
        "label": "Experience / Evidence",
        "start_seconds": 22,
        "end_seconds": 34,
        "required": false,
        "description": "Personal experience, before/after results, or social proof"
      },
      {
        "name": "recommendation_and_cta",
        "label": "Recommendation & CTA",
        "start_seconds": 34,
        "end_seconds": 40,
        "required": false,
        "description": "Direct purchase recommendation with link, code, or discount reference"
      }
    ]
  },
  "scoring": {
    "weights": {
      "hook_and_result_strength": 25,
      "speech_clarity": 20,
      "product_visibility": 20,
      "demonstration_value": 15,
      "evidence_and_credibility": 10,
      "technical_quality": 10
    }
  },
  "audio": {
    "bgm_volume_percent": 8,
    "duck_bgm_under_speech": true
  },
  "subtitle": {
    "font": {
      "size": 48,
      "bold": true
    }
  },
  "preprocessing": {
    "mode": "strict",
    "remove_filler_words": true,
    "remove_configured_pauses": true,
    "caption_grouping": {
      "enabled": true,
      "words_per_group_min": 2,
      "words_per_group_max": 5
    },
    "punch_in": {
      "enabled": true,
      "keywords": ["sản phẩm", "giá", "mua ngay", "link", "giảm giá", "khuyến mãi", "chất lượng"]
    }
  }
}
